{"curriculumSchemaVersion":1,"curriculumId":"test-english-course","curriculumVersion":1,"publicationState":"published","title":"TEST English Course","description":"TEST-only curriculum proving non-contiguous canonical CEFR levels.","targetLanguage":"en","referenceLocale":"en-US","levels":[{"levelId":"a1","cefrLevel":"A1","title":"Beginner","description":"TEST A1 content.","objectives":["Introduce yourself."],"units":[{"unitId":"a1-introductions","title":"Introductions","description":"Practice introductions.","objectives":["Introduce yourself."],"skillFocus":["vocabulary","speaking","interaction"],"grammarTopics":["verb be"],"vocabularyTopics":["names"],"communicativeFunctions":["introducing yourself"],"lessons":[{"lessonId":"test-introductions","contentVersion":2}]}]},{"levelId":"b1","cefrLevel":"B1","title":"Intermediate","description":"TEST B1 content.","objectives":["Handle travel problems."],"units":[{"unitId":"b1-travel-problems","title":"Travel Problems","description":"Explain common travel problems.","objectives":["Explain a delay."],"skillFocus":["vocabulary","speaking","interaction"],"grammarTopics":["present perfect"],"vocabularyTopics":["transport"],"communicativeFunctions":["reporting a problem"],"lessons":[{"lessonId":"test-travel-problems","contentVersion":1}]}]}]}
