{"curriculumSchemaVersion":1,"curriculumId":"test-draft-course","curriculumVersion":1,"publicationState":"draft","title":"TEST Draft Course","description":"This valid draft must not appear publicly.","targetLanguage":"en","referenceLocale":"en-US","levels":[{"levelId":"a1","cefrLevel":"A1","title":"Draft A1","description":"Draft test level.","objectives":[],"units":[{"unitId":"a1-draft","title":"Draft Unit","description":"Draft test unit.","objectives":[],"skillFocus":[],"grammarTopics":[],"vocabularyTopics":[],"communicativeFunctions":[],"lessons":[{"lessonId":"test-draft","contentVersion":1}]}]}]}
